{
  "manifestId": "artifact-manifest-dashboard-sample",
  "createdAt": "2026-06-09T13:45:00+08:00",
  "checksum": "mock-sha256-artifact-manifest-0001",
  "verifyStatus": "verified",
  "artifactRefs": [
    "apps/dashboard/data/dashboard-export.sample.json",
    "apps/dashboard/data/agent-registry.sample.json",
    "apps/dashboard/data/task-runs.sample.json",
    "apps/dashboard/data/audit-events.sample.json",
    "apps/dashboard/data/backup-manifests.sample.json"
  ],
  "dashboardData": {
    "agents": [
      {
        "id": "agent-orchestrator",
        "name": "Orchestrator Agent",
        "role": "Task routing and coordination",
        "runtime": "Codex runtime",
        "model": "gpt-5-codex",
        "workspace": "OPENCLAW GGB",
        "sandbox": "workspace-write mock",
        "toolsProfile": "routing, task memory, review handoff",
        "status": "busy",
        "lastHeartbeat": "2026-06-09T12:36:00+08:00",
        "riskLevel": "high",
        "responsibilities": ["Route tasks", "Coordinate RAG", "Plan retry and cancel flows"],
        "allowedActions": ["Create task plan", "Update task memory", "Open review gate"],
        "deniedActions": ["Call production mutation endpoint", "Read secrets", "Deploy runtime"]
      },
      {
        "id": "agent-research",
        "name": "Research Agent",
        "role": "Evidence gathering",
        "runtime": "Codex runtime",
        "model": "gpt-5-mini",
        "workspace": "docs and specs",
        "sandbox": "read-only mock",
        "toolsProfile": "reference search, evidence bundle",
        "status": "online",
        "lastHeartbeat": "2026-06-09T12:33:00+08:00",
        "riskLevel": "medium",
        "responsibilities": ["Gather references", "Summarize evidence", "Attach artifact refs"],
        "allowedActions": ["Create evidence bundle", "Read public docs"],
        "deniedActions": ["Store private data", "Store credentials", "Mutate gateway state"]
      },
      {
        "id": "agent-spec",
        "name": "Spec Agent",
        "role": "Contracts and acceptance criteria",
        "runtime": "Codex runtime",
        "model": "gpt-5-codex",
        "workspace": "docs/dashboard",
        "sandbox": "workspace-write mock",
        "toolsProfile": "schema, API, UI spec",
        "status": "online",
        "lastHeartbeat": "2026-06-09T12:34:00+08:00",
        "riskLevel": "medium",
        "responsibilities": ["Define schemas", "Write API contracts", "Draft UI specs"],
        "allowedActions": ["Edit specs", "Write acceptance criteria"],
        "deniedActions": ["Enable production auth", "Change deploy workflow"]
      },
      {
        "id": "agent-builder",
        "name": "Builder Agent",
        "role": "Implementation",
        "runtime": "Codex runtime",
        "model": "gpt-5-codex",
        "workspace": "apps/dashboard",
        "sandbox": "workspace-write mock",
        "toolsProfile": "patch, static scaffold, verification",
        "status": "busy",
        "lastHeartbeat": "2026-06-09T12:37:00+08:00",
        "riskLevel": "high",
        "responsibilities": ["Build UI", "Create mock data", "Run checks"],
        "allowedActions": ["Edit scaffold", "Run local verification"],
        "deniedActions": ["Commit secrets", "Call live backup restore", "Deploy"]
      },
      {
        "id": "agent-reviewer",
        "name": "Reviewer Agent",
        "role": "Review and policy gate",
        "runtime": "Codex runtime",
        "model": "gpt-5-codex",
        "workspace": "repo",
        "sandbox": "read-only mock",
        "toolsProfile": "code review, policy gate, test review",
        "status": "online",
        "lastHeartbeat": "2026-06-09T12:30:00+08:00",
        "riskLevel": "medium",
        "responsibilities": ["Review code", "Check policy", "Review tests"],
        "allowedActions": ["Record verdict", "Request changes"],
        "deniedActions": ["Approve production release automatically", "Bypass review gate"]
      },
      {
        "id": "agent-release",
        "name": "Release Agent",
        "role": "Release handoff",
        "runtime": "Codex runtime",
        "model": "gpt-5-mini",
        "workspace": "release notes",
        "sandbox": "read-only mock",
        "toolsProfile": "PR notes, release notes, CI handoff",
        "status": "offline",
        "lastHeartbeat": "2026-06-09T11:50:00+08:00",
        "riskLevel": "medium",
        "responsibilities": ["Prepare release notes", "Summarize CI", "Coordinate handoff"],
        "allowedActions": ["Draft release notes", "Prepare PR checklist"],
        "deniedActions": ["Push deploy", "Rotate secrets"]
      },
      {
        "id": "agent-monitor",
        "name": "Monitor Agent",
        "role": "Health and SLA monitor",
        "runtime": "Codex runtime",
        "model": "gpt-5-mini",
        "workspace": "observability",
        "sandbox": "read-only mock",
        "toolsProfile": "SLA, health, lost task alert",
        "status": "degraded",
        "lastHeartbeat": "2026-06-09T12:20:00+08:00",
        "riskLevel": "high",
        "responsibilities": ["Watch SLA", "Flag lost tasks", "Report alerts"],
        "allowedActions": ["Create alert record", "Update mock health"],
        "deniedActions": ["Restart production services", "Page external systems"]
      },
      {
        "id": "agent-backup-audit",
        "name": "Backup Audit Agent",
        "role": "Backup evidence and restore drill",
        "runtime": "Codex runtime",
        "model": "gpt-5-mini",
        "workspace": "artifacts",
        "sandbox": "read-only mock",
        "toolsProfile": "export, checksum, backup verify",
        "status": "online",
        "lastHeartbeat": "2026-06-09T12:35:00+08:00",
        "riskLevel": "high",
        "responsibilities": ["Verify checksums", "Track manifests", "Record restore drills"],
        "allowedActions": ["Write mock manifest", "Record checksum"],
        "deniedActions": ["Restore production backup", "Expose storage credentials"]
      }
    ],
    "tasks": [
      { "id": "TASK-20260609-OC-DASH-001", "workflow": "FLOW-openclaw-dashboard-core", "status": "running", "priority": "P1", "attempt": 1, "ownerAgent": "agent-builder", "reviewer": "agent-reviewer", "createdAt": "2026-06-09T12:00:00+08:00", "updatedAt": "2026-06-09T12:37:00+08:00", "summary": "Create dashboard scaffold and Markdown memory system." },
      { "id": "TASK-20260609-OC-REVIEW-002", "workflow": "FLOW-review-gate", "status": "review_pending", "priority": "P2", "attempt": 1, "ownerAgent": "agent-spec", "reviewer": "agent-reviewer", "createdAt": "2026-06-09T10:20:00+08:00", "updatedAt": "2026-06-09T11:15:00+08:00", "summary": "Validate API contract shape before adapter design." },
      { "id": "TASK-20260609-OC-BACKUP-003", "workflow": "FLOW-backup-evidence", "status": "queued", "priority": "P2", "attempt": 0, "ownerAgent": "agent-backup-audit", "reviewer": "agent-reviewer", "createdAt": "2026-06-09T09:40:00+08:00", "updatedAt": "2026-06-09T09:40:00+08:00", "summary": "Draft backup manifest evidence chain." },
      { "id": "TASK-20260608-OC-MONITOR-004", "workflow": "FLOW-health-monitor", "status": "lost", "priority": "P0", "attempt": 2, "ownerAgent": "agent-monitor", "reviewer": "agent-reviewer", "createdAt": "2026-06-08T18:00:00+08:00", "updatedAt": "2026-06-09T08:10:00+08:00", "summary": "Investigate stale heartbeat in mock monitor stream." },
      { "id": "TASK-20260608-OC-BUILD-006", "workflow": "FLOW-scaffold-check", "status": "failed", "priority": "P2", "attempt": 1, "ownerAgent": "agent-builder", "reviewer": "agent-reviewer", "createdAt": "2026-06-08T12:00:00+08:00", "updatedAt": "2026-06-08T12:45:00+08:00", "summary": "Mock failed task used to verify lifecycle visibility." },
      { "id": "TASK-20260608-OC-SPEC-005", "workflow": "FLOW-spec-authoring", "status": "succeeded", "priority": "P3", "attempt": 1, "ownerAgent": "agent-spec", "reviewer": "agent-reviewer", "createdAt": "2026-06-08T14:00:00+08:00", "updatedAt": "2026-06-08T16:25:00+08:00", "summary": "Draft first-pass task workflow lifecycle labels." },
      { "id": "TASK-20260608-OC-TIMEOUT-007", "workflow": "FLOW-timeout-check", "status": "timed_out", "priority": "P3", "attempt": 1, "ownerAgent": "agent-monitor", "reviewer": "agent-reviewer", "createdAt": "2026-06-08T10:00:00+08:00", "updatedAt": "2026-06-08T10:30:00+08:00", "summary": "Mock timed-out task used to verify lifecycle visibility." },
      { "id": "TASK-20260608-OC-CANCEL-008", "workflow": "FLOW-cancel-check", "status": "cancelled", "priority": "P3", "attempt": 1, "ownerAgent": "agent-orchestrator", "reviewer": "agent-reviewer", "createdAt": "2026-06-08T09:00:00+08:00", "updatedAt": "2026-06-08T09:20:00+08:00", "summary": "Mock cancelled task used to verify lifecycle visibility." }
    ],
    "reviews": [
      { "id": "review-dash-001", "taskId": "TASK-20260609-OC-DASH-001", "reviewer": "agent-reviewer", "verdict": "pending", "policyChecks": ["mock-only UI", "no secrets", "no production endpoint"], "notes": "Awaiting scaffold verification.", "createdAt": "2026-06-09T12:40:00+08:00" }
    ],
    "auditEvents": [
      { "id": "audit-001", "timestamp": "2026-06-09T12:42:00+08:00", "severity": "info", "actor": "agent-builder", "event": "Dashboard scaffold files created.", "redacted": false, "taskId": "TASK-20260609-OC-DASH-001", "agentId": "agent-builder" }
    ],
    "backups": [
      { "id": "backup-dash-001", "taskId": "TASK-20260609-OC-DASH-001", "verifyStatus": "pending", "checksum": "mock-sha256-backup-0001", "storageUri": "mock://artifact-bundle/TASK-20260609-OC-DASH-001", "createdAt": "2026-06-09T12:42:00+08:00", "restoreTestedAt": null, "evidenceChain": ["git commit: pending", "artifact bundle: docs/dashboard", "checksum: mock-sha256-backup-0001", "backup manifest: backup-dash-001"] }
    ],
    "metrics": [